{
  "$id": "https://masagdt.github.io/wellknownindex/schema/registry-entry.json",
  "$schema": "https://json-schema.org/draft/2020-12/schema",
  "additionalProperties": true,
  "description": "Schema for a WellKnownIndex registry entry: the frontmatter of content/registry/<slug>.md, or the same shape as a JSON submission.",
  "properties": {
    "auth_schemes": {
      "description": "How an agent authenticates, as slugs.",
      "items": {
        "description": "e.g. ai-access-grant, agent-credential, invitation-link.",
        "type": "string"
      },
      "type": "array"
    },
    "cost": {
      "description": "e.g. free, unknown, or a short pricing note.",
      "type": "string"
    },
    "methods_implemented": {
      "description": "WellKnownIndex method slugs this site implements.",
      "items": {
        "description": "e.g. stage-and-approve, machine-readable-primer.",
        "type": "string"
      },
      "type": "array"
    },
    "protocols": {
      "description": "The site's machine endpoints. Declare a version whenever the site publishes one.",
      "items": {
        "properties": {
          "type": {
            "description": "Protocol type slug, e.g. ai-primer, staging-api, mcp-bridge, well-known.",
            "type": "string"
          },
          "version": {
            "description": "The protocol's declared version, e.g. \"1.3.0\". Recommended: agents pin behavior to it; breaking changes bump the major number.",
            "type": "string"
          },
          "url": {
            "description": "Where the protocol lives: an absolute URL or a site-relative path.",
            "type": "string"
          }
        },
        "required": [
          "type",
          "url"
        ],
        "type": "object"
      },
      "type": "array"
    },
    "scopes": {
      "description": "The permission vocabulary, if the site has one.",
      "items": {
        "type": "string"
      },
      "type": "array"
    },
    "site_url": {
      "description": "The site's home page, or null if it is not publicly reachable.",
      "type": [
        "string",
        "null"
      ]
    },
    "summary": {
      "minLength": 1,
      "type": "string"
    },
    "title": {
      "minLength": 1,
      "type": "string"
    },
    "verified": {
      "description": "Date of the last real verification check, YYYY-MM-DD. Never advanced by a rebuild \u2014 only by a new check.",
      "pattern": "^[0-9]{4}-[0-9]{2}-[0-9]{2}$",
      "type": "string"
    },
    "verified_evidence": {
      "description": "What the verification actually checked, one line per check: fetched endpoints, confirmed flows, known limitations.",
      "items": {
        "type": "string"
      },
      "type": "array"
    }
  },
  "required": [
    "title",
    "summary",
    "site_url",
    "protocols",
    "auth_schemes",
    "methods_implemented",
    "cost",
    "verified"
  ],
  "title": "WellKnownIndex registry entry",
  "type": "object",
  "protocols": {
    "description": "The site's machine endpoints. Exact callable endpoints go in url; URI templates in url_template; explanations in note. An endpoint that cannot be established uses status 'unconfirmed' with a note \u2014 never prose inside url.",
    "items": {
      "properties": {
        "type": {
          "description": "Protocol type slug, e.g. ai-primer, staging-api, mcp-bridge, well-known.",
          "type": "string"
        },
        "version": {
          "description": "The protocol's declared version, e.g. \"1.3.0\". Recommended: agents pin behavior to it; breaking changes bump the major number.",
          "type": "string"
        },
        "url": {
          "description": "Exact callable endpoint: a clean absolute URL. No prose, no unexpanded placeholders.",
          "type": "string",
          "pattern": "^https?://\\S+$"
        },
        "url_template": {
          "description": "URI template containing a {placeholder}, e.g. https://example.org/review?token={token}.",
          "type": "string"
        },
        "note": {
          "description": "Explanation for agents: what is unconfirmed, where to look instead, caveats.",
          "type": "string"
        },
        "status": {
          "description": "'confirmed' (default) or 'unconfirmed'. Unconfirmed requires a note and forbids guessing a URL.",
          "type": "string",
          "enum": [
            "confirmed",
            "unconfirmed"
          ]
        }
      },
      "required": [
        "type"
      ],
      "type": "object"
    },
    "type": "array"
  }
}