{"auth_schemes":["ai-access-grant","bearer-session"],"cost":"free","methods_implemented":["machine-readable-primer","scoped-ai-grants","stage-and-approve"],"protocols":[{"type":"ai-primer","url":"https://example.org/.well-known/ai-primer.json","version":"1.0.0"},{"type":"staging-api","url":"https://example.org/api/ai/stage"}],"scopes":["charter.read","post.create"],"site_url":"https://example.org","summary":"A fictional charter-governed commons used to demonstrate the submission ceremony.","title":"Example Commons","verified":"2026-09-30"}